{"actor_id":"modeler","constraints":[],"data_split":{"features":["x"],"fit_ids":["row1","row2"],"sample_groups":{},"sample_times":{},"strategy":"holdout","target":"observed_y","test_ids":["row3"],"train_ids":["row1","row2"]},"decision_id":"decision1","formulae":[{"expression":"y=a*x+b","formula_id":"affine","input_symbols":["x","a","b"],"output_symbol":"y","unit_check":"All variables and terms dimensionless."}],"implementation":{"code_files":["code/prediction.py"],"entrypoint":"code/prediction.py","language":"python"},"inputs":["problem"],"limits":{"memory_mb":null,"timeout_seconds":30},"method_id":"affine-main","objective":{"expression":"mean((y-y_hat)^2)","metric":"mse","sense":"min"},"outputs":[{"fields":[{"name":"value","type":"number","unit":"1"}],"format":"json","name":"prediction","path":"results/predictions.json","precision":6}],"parameters":{},"question_id":"Q1","schema_version":"2.0","seed":42,"task_type":"regression","validation_plan":{"checks":["holdout-mse"],"independent_entrypoint":"validators/prediction.py"},"variables":["x","y","a","b"]}
